<!--
  -
  - "-//AIS.PL//DTD Forms Description 0.4//EN"
  - "http://www.ais.pl/dtds/forms_0_4.dtd"
  -
  - wswiatek, last modified: 23.09.2002
  -
  - Warlock, last modified: 07.03.2002
  -
  - base 0.2 version created on 06.03.2002
  -
  - changes since base 0.2 version:
  - 2002.03.07: added 'property' child for element 'rule'
  - 2002.09.23: added many new features
  -->

<!ELEMENT forms (form+)>

<!ELEMENT form (fields,rules?)>

<!ATTLIST form 
          name          CDATA #REQUIRED>

<!ELEMENT fields (field+)>

<!ELEMENT field (builder?, validation*)>

<!ATTLIST field 
          class         CDATA #REQUIRED
          name          CDATA #REQUIRED
          dynamic       CDATA 'false'>

<!ELEMENT builder (property*, builder-mapping+)>

<!ATTLIST builder
          class         CDATA #REQUIRED>

<!ELEMENT builder-mapping EMPTY>

<!ATTLIST builder-mapping
          field-param CDATA #REQUIRED
          field-name  CDATA #REQUIRED>

<!ELEMENT validation (property*)>

<!ATTLIST validation 
          msg-code      CDATA #REQUIRED>

<!ELEMENT rules (rule+)>

<!ELEMENT rule (property*, mapping+)>

<!ATTLIST rule 
          class     CDATA #REQUIRED
          msg-code  CDATA #REQUIRED
          name      CDATA #REQUIRED>

<!ELEMENT property EMPTY>

<!ATTLIST property 
          name   CDATA #REQUIRED
          value  CDATA #REQUIRED>

<!ELEMENT mapping EMPTY>

<!ATTLIST mapping 
          field-name  CDATA #REQUIRED
          rule-param  CDATA #REQUIRED>
